reviews ,overall_rating,review_date,trip_type,room_rating,service_rating,location_rating,platform
Had a good stay for affordable price . Overall I had good experience and had food from there for affordable price. The room was very neat and clean . The staff was also very nice.,5,Jan-25,family,5,5,4,google
Excellent and Friendly service at the restaurant … The Food was not tasty and insipid. Moreover the portions are extremely small and no value for money . Will not visit the restaurant again but again I may just go for a tea because of the lovely warm staff in the restaurant,3,Nov-24,solo,3,3,4,google
New property. Luxurious rooms. Good variety of veg and non veg buffet breakfast. Overall comfortable stay I had.,5,Oct-24,solo,5,5,5,google
"Hotel is nice and new but the staffs are not competent enough. Very lethargic and in their own world. I couldn’t login to my room TV internet then front desk said they will reset the password and let me know. Called once no response called twice no response and called thrice no response. I gave up and thought of taking a nap. Just with in 30mins after check-in, room service guy kept ringing the door bell and asked if we need room cleaning?
Room intercom doesn’t have any stickers with which number to call where?
No hair dryer in the bathroom.",3,May-25,solo,4,2,5,google
Room is very comfortable Front desk staff very friendly and helpful Person,5,Jan-25,business,5,4,5,google
Staff is v v nice specially the front office lady Bhoomika and the Shef Mohammad,5,Feb-25,solo,5,5,5,google
The great place to spent time with family,5,Feb-25,family,5,5,5,google
"Awesome place, for corporate stay and meetings,rooms were spacious, great ambiance",5,Feb-25,solo,5,5,5,google
Awesome facilities and tasty healthy breakfast,5,Jun-25,solo,5,5,5,google
Orders get little delayed when there is crowd. Food was good,4,Mar-25,solo,4,4,5,google
"A very luxurious hotel. Right from the check-in to the check out, all the services are very good. I have utilized the gym, and it is also good. The checkout is also quick.",4,Jun-25,friends,4,4,4,google
Water in the wash basin didn’t drain out quickly. Hot water in the bathroom was not hot enough. Other than that it was good service.,4,Apr-25,business,4,4,4,google
"Never expected such a metro kind of experience in a tier 3 town like Erode. Everything was perfect. The only small challenge I felt was, when the restaurant is full, the team is unable to serve promptly.",5,Jun-24,solo,5,5,5,google
"Clean, modern, new, comfortable, hotel with a wonderful restaurant and very helpful staff. Great location and ample, safe parking also available. Would definitely recommend.",5,Jul-24,solo,5,5,5,google
"Amazing Hotel to stay..Slightly away from the city. Good parking space, Good food and the breakfast buffet is excellent..a mix of South Indian and continental",5,Apr-25,couple,5,5,5,google
"Hospitality thy name is TURMERIC!
Service with a smile from the supportive staff created very good memories at this boutique luxurious hotel...an unexpected experience at erode shirt stay",5,Nov-24,couple,5,5,5,google
Visiting from US and traveled to Erode for business. Rooms were comfortable and clean. Staff was competent. Restaurant was good. Would stay here again.,4,Oct-24,solo,4,4,4,google
Very nicely decorated restaurant but service needs to be improved greatly. Need more professional staff to do justice to the upscale restaurant. Dinner shouldn't take 3 hours to complete.,3,Oct-24,solo,4,3,5,google
"Very spacious and comfortable stay.. Breakfast was good.. Néw hotel, clean with good bed.. Definitely recommend for a stay over",5,Aug-24,couple,5,5,5,google
The reception hall is good and the rooms are very good .,4,Jun-25,business,4,4,4,google
"Nice hospitality with big rooms. Front desk and room service team are cooperative. I strongly recommend for business travel, family trips",5,Apr-25,business,5,4,4,google
Everything about this hotel is very very good. From the lobby to the restaurant to the rooms and very well behaved staff. Absolutely loved it,5,Apr-25,solo,5,5,5,google
Staff here are rowdies pls be careful they will mess with ur peace of mind while staying,1,Mar-25,solo,1,1,1,google
Great place to stay enjoyed a lot the staffs were friendly rooms were very comfortable food was awesome,5,Oct-24,family,5,5,5,google
"First thing,the accommodation very neat.They maintained good housekeeping.The breakfast very nice.Staff also very friendly especially Mr Vinod and Mr Suresh.Overally best hotel and value for money.",5,Jun-24,business,5,5,5,google
"Its a new hotel, rooms were clean and neat. But food is very average and not worthy for the money",3,Jun-24,friends,3,2,3,google
Very very bad experience from management calls. Much disturbing to friends who came to meet us in room. Spoiled everyone mindset by poor management,1,Jun-24,friends,1,1,1,google
Service good responsible very very good food ultimate goo,5,Jun-25,family,5,5,5,google
"While being in a business trip, I had a very nice stay at this hotel. Very nice staff and the food was delicious my compliment to the chef",4,Jul-24,solo,4,4,5,google
Such a posh hotel with live spiders in room. There were close to 5 spiders in room.,1,Oct-24,solo,1,4,4,google
The restaurant in this hotel is really good. The service is excellent.,5,Nov-24,family,5,5,5,google
Awesome place... spacious and neat room. Clean bathroom. Good customer service at an affordable price,5,Jun-24,family,5,5,5,google
Hotel staff without ethics and honesty ....will do anything they want,1,Nov-24,solo,1,1,1,google
Room was good and spacious.,4,Jun-25,solo,5,4,4,google
"One of the best hotels I have stayed. Hospitality, services and food top notch. Bravo",5,Jun-24,business,5,5,5,google
Harrasement for families .....worst hotel ....misleading pictures ....no parking facilities .....,1,Apr-25,family,1,1,1,google
taste of the food is a big question mark and that too for the pricing,4,Jun-24,family,4,3,4,google
Plz lookafter to improve food taste and quality,4,Oct-24,family,4,4,4,google
"I am attending expo
very nice place",5,Oct-24,family,4,4,4,google
Comfortable and a well maintained hotel,5,Nov-24,family,5,4,5,google
Worst people no disciple,1,Feb-25,family,1,1,1,google
Rooms are expensive for the facility provided.,3,Feb-25,business,4,3,4,google
Ambient good,4,Feb-25,business,4,4,4,google
Restaurant is good.,5,Apr-25,family,4,4,4,google
We went to restaurants Wrost service bed service,1,Jun-24,family,1,1,1,google
Meeting hall was great ,4,Nov-24,solo,4,4,4,google
The Dinning Hall With Banquet Hall Is Too Small,5,Nov-24,friends,5,5,5,google
"It was a pleasent stay at Hotel Turmeric, Erode.",5,Apr-25,solo,5,5,5,google
good to have functions..... get togethers....,5,Jun-24,solo,5,5,5,google
Calm restaurant and tasty food...,5,Nov-24,family,4,5,5,google
Newly built Hotel and easy to access.,4,Jul-24,family,4,4,4,google
Good choice in erode… new property .,5,Aug-24,family,5,4,5,google
Well designed hotel at Erode,5,Aug-24,family,5,4,5,google
Not focus in rest room,2,Aug-24,family,2,3,4,google
Becoming a good business hotel .,4,Oct-24,solo,4,3,4,google
Food taste was not that much impressive,5,Oct-24,family,4,3,4,google
Your contact number is switched off…,3,Jul-24,solo,3,3,3,google
Nice stay,5,Oct-24,solo,5,5,5,google
Good.,4,Nov-24,friends,4,4,4,google
Excellent,4,Nov-24,business,4,4,4,google
Good service,5,Oct-24,solo,5,5,5,google
Nice Hotel in Erode,4,Jul-24,solo,4,4,4,google
Highly recommended,5,Jun-24,solo,5,5,5,google
Bit costly. Can try once especially appam.,3,Jun-24,solo,4,3,3,google
" We chose this hotel for its swimming pool. When checking in, the receptionist gives us his opening hours: from 6am to 6pm. Once in the room, we go for a swim and... The swimming pool is closed! The same receptionist confirmed to me that the swimming pool was closed for maintenance for several days, even though he had not told us anything at check-in.
Very disappointed
Much too expensive given the lack of service.",3,Nov-24,couple,5,2,3,google
